jpb_id,title,posted,company_name,skills,exp,salary,offered_location,job_Description
180723905466,Senior Data Scientist - Machine Learning & Predictive Modeling,15 Days Ago,HyrEzy Talent Solution,"Machine Learning,Data Science,Data Visualization,Python,Predictive modeling,Senior,Modeling,Predictive",10-15 Yrs,Not disclosed,Pune,"Degree in computer science,statistics,mathematics,or a related field,. - Proficiency in programming languages such as Python or R,and experience working with databases,data visualization tools,and machine learning algorithms.  . - Excellent analytical and problem-solving skills,as well as strong communication and collaboration skills,are also important for success in this role.  ."
180723006499,Urgent Opening For Data Scientist,15 Days Ago,Peoplefy Infosolutions,"Data Science,Tensorflow,Natural Language Processing,sensor,machine learning,Deep Learning,Machine,Science",8-13 Yrs,Not disclosed,"Hybrid - Pune, Maharashtra",Primary Skills: . Good experience in data science machine learning<br><br>Prior experience on sensor data desirable<br><br>Experience:8 to 16 Years.
170723501414,Data Scientist - Lead,16 Days Ago,DataMetica Solutions Private Limited,"GCP,Analytical,Project management,Machine learning,Programming,Presales,Data mining,Analytics",8-12 Yrs,Not disclosed,Pune,"Liaison with customers on analytics solutions and identify new  <br /> opportunities. <br /> <br /> Work closely with the Pre-Sales & Business development team to acquire new  <br /> clients <br /> <br /> for Analytics and creating SOWs, proposals for Analytics solutions <br /> <br /> Responsible for formulating a problem statement and implementing analytical <br /> <br /> solutions by understanding available data and functional requirements. <br /> <br /> Responsible for data and requirements gathering; solution scoping and  <br /> architecture <br /> <br /> Responsible for managing, developing and maintaining analytics to solve  <br /> complex business problems <br /> <br /> Work closely with Data Scientist team to deliver solutions using advanced  <br /> statistical, <br /> <br /> machine learning and deep learning techniques <br /> <br /> Ability to generate insights and demonstrate value to customers <br /> <br /> Test various machine learning and analytical tools, build prototypes which  <br /> can be <br /> <br /> easily scaled up for production deployments <br /> <br /> Experience of working on Cloud Platforms (GCP/Azure) and Cloud Native AI /  <br /> ML <br /> <br /> Components and services <br /> <br /> Experience of big data technologies and distributed computing concepts will  <br /> be an advantage. <br /> <br /> Excellent Project Management skills with the ability to manage multiple  <br /> analytics <br /> <br /> projects simultaneously to achieve business results <br /> <br /> Good knowledge of SQL and high level proficiency in R / Python /Pyspark. <br /> <br /> High-level proficiency in statistical, machine, deep learning techniques  <br /> such as <br /> <br /> regression, Bayesian methods, tree-based learners, SVM, Yolo,LLM  <br /> architectures etc. <br /> <br /> Excellent Problem solving skills with the ability to translate business  <br /> objectives into <br /> <br /> analytical frameworks <br /> <br /> Knowledge of Generative AI and experience of using Large Language Models,  <br /> OpenAI <br /> <br /> Solving use cases with pre-trained architectures. <br /> <br /> Solving use cases with Transfer learning and Meta learning. <br /> <br /> <strong> Key Skills Required </strong> <br /> <br /> Great communication skills, ability to meet deadlines and prioritize  <br /> workload <br /> <br /> Demonstrated high degree of organization and ability to manage multiple,  <br /> competing <br /> <br /> priorities <br /> <br /> Should possess extensive knowledge of and experience in applying data  <br /> mining and <br /> <br /> machine learning techniques in a project context <br /> <br /> Excellent understanding of machine learning, deep learning, NLP algorithms  <br /> and <br /> <br /> Recommendation systems. <br /> <br /> Excellent Project Management skills with the ability to manage multiple  <br /> analytics <br /> <br /> projects simultaneously to achieve business results <br /> <br /> Willingness to try new technologies and languages and ability to grasp and  <br /> learn <br /> <br /> quicklyStrong Programming Skills in Python / R / PySpark, SQL <br /> <br /> <strong> Good To Have Skills </strong> <br /> <br /> Experience in ML Ops <br /> <br /> Knowledge and experience of DevOps <br /> <br /> GCP ML Engineer Certification or Microsoft Azure Data Science Certification  <br /> or equivalent"
170723501413,Data Scientist,16 Days Ago,DataMetica Solutions Private Limited,"data cleansing,Telecom,Statistical analysis,GCP,Machine learning,Healthcare,data visualization,Data mining",6-10 Yrs,Not disclosed,Pune,"Solving use cases with Transfer learning and Meta learning . Key Skills Required . Strong Programming Skills in Python / R / PySpark,SQL . Strong problem solving and analytical skills . Great communication skills,Extreme attention to detail,ability to meet <br><br>Knowledge and experience of DevOps . GCP ML Engineer Certification or Microsoft Azure Data Science Certification"
130723006913,Data Science Trainer,20 Days Ago,Fusion Software Institute,"Machine Learning,Deep Learning,data science,Predictive Modeling,Streamlining Operations,algorithms,python,data analysis",3-5 Yrs,4-9 Lacs PA,"Pune, Maharashtra(Kharadi)","Preferred candidate profile : As a Data Science Trainer,you will be responsible for delivering high-quality training and education programs to individuals or groups of students aspiring to become proficient in data science"
130623500069,Senior Specialist - NLP Product Development,30+ Days Ago,3analytics,"Computer science,Product Development Manager,Pharma,Artificial Intelligence,Machine learning,Linguistics,Natural language processing,Mathematics",3-7 Yrs,Not disclosed,"Pune, Chennai",Certified Natural Language Processing Programmer <br><br>Preferred but not must <br><br>Experience in Deep Semantic Similarity Models (DSSM) <br><br>Understand pharmaceutical domain and technology with experience in building an ecosystem for a product development or service using deep machine learning and artificial intelligence<br><br>Experience . 3 to 7 Years in a Product Company
120321500863,Data Scientist and Analyst,30+ Days Ago,Diverse Lynx,"Data management,Business analytics,Machine learning,data governance,Data Analyst,Data quality,Natural language processing,Data mining",2-6 Yrs,Not disclosed,Pune,"Maintain company master data per established data governance standards. Must Have Knowledge and experience in python,tableau,deep learning,machine learning,natural language processing,Business Analytics,Predictive Analytics,Statistical Modeling,Data Mining,SQL"
100723501569,Data Scientist,23 Days Ago,Husk Power Systems,"Product management,Data analysis,SAS,Data collection,Data processing,Predictive modeling,Data mining,MATLAB",5-8 Yrs,Not disclosed,Pune," . Master s Degree in Computer Science,Statistics,Applied Math or related field . 5+ years practical experience with SAS,ETL,data processing,database programming and data analytics . Extensive background in data minin"
050423500632,NLP Engineer / Sr NLP Engineer,30+ Days Ago,Simplifai Cognitive Services,"Process automation,Text mining,data science,Artificial Intelligence,Machine learning,Data mining,Business solutions,SQL",4-9 Yrs,Not disclosed,Pune,"<p> Work with customers to identify opportunities for leveraging their data to drive business solutions.  </p> <p> Develop custom data models and algorithms.  </p> <p> Working with research on latest trends and implementing in the current system.  </p> <p> Basic data cleaning and annotation for any incoming raw data.  </p> <p> Develop company A/B testing framework and test model quality.  </p> <p> Deployment of ML model in production.  </p> <p> Coordinate with different functional teams to implement models and monitor outcomes.  </p> <p> Develop processes and tools to monitor and analyze model performance and data accuracy.  </p> <p> <strong> Qualifications for Senior Data Scientist  </strong> </p> <p> MS in Computer Science, Engineering, or related discipline.  </p> <p> 4+ Years of hands-on experience in Data Science/Machine Learning.  </p> <p> Experience with programming language Python.  </p> <p> Familiar with at least one database query language, such as SQL  </p> <p> Knowledge of Text Classification Clustering, Question Answering Query  </p> <p> Understanding, Search Indexing Fuzzy Matching.  </p> <p> Excellent written and verbal communication skills for coordinating across teams.  </p> <p> Willing to learn and master new technologies and techniques.  </p> <p> Knowledge and experience in statistical and data mining techniques.  </p> <p> Experience with Spacy, NLTK, text mining or other NLP techniques.  </p> <p> Experience working with and creating data architectures.  </p> <p> Experience in deploying machine learning model in production.  </p> <p> Experience with research and writing publication.  </p> <p> Experience with Transfer learning is plus.  </p> <p> Experience using cloud services: Azure or AWS etc. is plus  </p>"
030723003481,"Hiring Data Scientist (M.Tech / PHD ) - Product MNC, Kharadi, Pune",30 Days Ago,Peoplefy Infosolutions,"Natural Language Processing,deep learning,sentiment analysis,Analysis,Languages,Processing,Data,Process",8-13 Yrs,Not disclosed,"Hybrid - Pune, Maharashtra","<p> Greetings from Peoplefy Info-solutions, </p><br /><p>We are hiring for one of our esteemed clients which is a globally leading MNC for their Technology centre in Pune. </p><br /><br /><p><strong>Required skill are :</strong></p><br /><ul><li>8+ years of overall machine learning/advanced analytics experience with considerable time spent in building enterprise grade solutions.</li><li> NLP solution building and applied research experience including 4+ years in Python</li><li>Strong experience developing and implementing NLP algorithms in a commercial setting</li><li>Expert in NLP methodologies: document embedding, text mining, topic classification, sentiment analysis, information extraction, conversational AI, generative AI etc.</li><li>Expert in deep learning models for sequence-to-sequence problems like LSTMs, GRUs, RNNs</li><li>Experience with NLTK, Spacy, Gensim, HuggingFace Transformers</li><li>PhD / MTech / MS degree in Computer Science or related IT / technology field or equivalent experience</li></ul><br /><p><strong>Experience</strong>: 7 to 15 Years</p><br /><p><strong>Location</strong>-Pune</p><br /><p>Interested candidates please share their updated resume at tejita.k@peoplefy.com</p><br /><br /><br />"
030723001073,"Hiring Data Scientist (M.Tech / PHD ) - Product MNC, Kharadi, Pune",30 Days Ago,Peoplefy Infosolutions,"Natural Language Processing,deep learning,sentiment analysis,Process,Analysis,Data,Hiring,Languages",8-13 Yrs,25-40 Lacs PA,"Hybrid - Pune, Maharashtra","<p> </p><p><strong>Required:</strong></p><br /><ul><li>8+ years of overall machine learning/advanced analytics experience with considerable time spent in building enterprise grade solutions.</li><li> NLP solution building and applied research experience including 4+ years in Python</li><li>Strong experience developing and implementing NLP algorithms in a commercial setting</li><li>Expert in NLP methodologies: document embedding, text mining, topic classification, sentiment analysis, information extraction, conversational AI, generative AI etc.</li><li>Expert in deep learning models for sequence-to-sequence problems like LSTMs, GRUs, RNNs</li><li>Experience with NLTK, Spacy, Gensim, HuggingFace Transformers</li><li>PhD / MTech / MS degree in Computer Science or related IT / technology field or equivalent experience</li></ul><br /><p><strong>Experience</strong>: 7 to 15 Years</p><br /><p><strong>Location</strong>-Pune</p><br /><br /><br /><br />"
301222501530,Senior Data Scientist,30+ Days Ago,Wolters Kluwer,"Compliance,Linux,Coding,Shell scripting,Machine learning,Data structures,Financial services,SQL",5-9 Yrs,Not disclosed,"Kalyani, Pune","<p> <b> </b>   </p> <ul> <li> Lead and Manage development, operations and maintenance of portfolio of AI models and related products. </li> <li> Manage AI models and Product releases. </li> <li> Develop AI product roadmaps and timelines. </li> <li> Manage internal and external AI audits. </li> <li> Define, create, and track metrics to measure the business value of existing and proposed AI products. Create and manage various dashboards. </li> <li> Manage effective collaboration within cross-functional teams. </li> <li> Dive deep into data, doing analysis, and discovering patterns/root causes. Generate insights that drive the product. </li> <li> Analyze and evaluate the quality of data used for model training and testing. </li> <li> Present proposals and results in a clear manner backed by data and coupled with actionable conclusions to drive business decisions. </li> <li> Communicate your results to diverse audiences with effective writing and visualizations. </li> <li> Manage deliverables and projects assigned to vendor partners in AI models and products space. </li> </ul> <p> <b> <span> ESSENTIAL SKILLS  </span> </b> </p> <ul> <li> Expertise in developing Machine Learning and Deep Learning solutions </li> <li> Expertise in developing Natural Language Processing (NLP) solutions </li> <li> Expert level knowledge of Python programming language, data engineering and data Science ecosystem in Python. Production level Python script and API coding experience is must have. </li> <li> Good knowledge of Python based frameworks like fastapi, streamlit, etc. </li> <li> Experience of working on Linux and shell scripting </li> <li> Hands on experience on SQL ecosystem </li> <li> Hands on experience on Solr framework with Python </li> <li> Sound Knowledge of statistical modelling </li> <li> Experience working in Cloud Native technologies from Azure and AWS stack like Cognitive Search, Form Recognizer, etc. </li> <li> Strong Computer Science fundamentals are must. (Data structures, Algorithms, OS, Databases). </li> <li> Good communication and organizational skills with significant attention to detail </li> <li> Experience partnering with cross-functional teams of engineers, data scientists, and designers to deliver extraordinary products. </li> <li> Strong attention to detail with excellent problem-solving skills. </li> <li> Desire and ability to thrive in a distributed technical environment while working on multiple projects simultaneously. </li> <li> Passionate about latest technology trends with a strong desire for innovation. </li> <li> Self-motivated, self-managing and able to work independently. </li> </ul> <p> </p> <p> </p> <p> <b> <span> EDUCATION AND EXPERIENCE </span> </b> </p> <p> </p> <ul> <li> Bachelors degree (B.E/ B Tech. computer science, engineering,  <span> statistics/mathematics </span>  or a related field) from a four-year college or university, or equivalent, Masters a plus. </li> </ul> <p> </p> <ul> <li> Total at least 6 years experience with at least 4 years experience working on enterprise AI products. </li> <li> Experience in creating software products or applications in the AI ML domain. </li> </ul>"
240521500341,Data Scientist (m/f/d),30+ Days Ago,Aioneers Gmbh,"Supply chain,Computer science,Supply chain management,Supply chain operations,QlikView,Continuous improvement,Econometrics,Analytics",3-7 Yrs,Not disclosed,Pune,"Experience on Azure Devops and Azure Databricks . <br><br>Experience with QlikSense / QlikView and / or other BI tools (PowerBI,Tableau etc.)<br><br>Experience in ETL processes scripts,proficiency in MS Excel ."
240521500103,Associate Data Scientist,30+ Days Ago,Innoplexus,"Computer science,Text mining,Computer vision,Image processing,Artificial Intelligence,Machine learning,Life sciences,Bioinformatics",2-7 Yrs,Not disclosed,Pune,"Required Experience . Strong track record in AI / ML publications in renowned scientific journals or conferences<br><br>Experience in any of the following: Computer Vision,Image Processing,Speech Recognition,Natural Language Understanding,Machine Learning,Deep Learning,HCI,Text Mining,Computational Genomics,Bioinformatics,other Machine Intelligence / Artificial Intelligence related areas"
190922500526,Data Science,30+ Days Ago,Mindstix Software Labs,"Microstrategy,SAN,Google Analytics,data science,Linux,Machine learning,Agile,Information technology",5-10 Yrs,Not disclosed,Pune," . Bachelors or Masters Degree in Computer Science / Information Technology / Statistics / Mathematics or relevant streams <br><br>Experience with Analytics tools like Google Analytics,Firebase,Tableau,Power-BI,Microstrategy <br><br>Experience in distributed computing frameworks: Apache Hadoop 0 (YARN<br><br>Experience with Kafka / Apache Spark (Streaming,SQL,MLLib)/ Apache Apex / Apache Storm"
170523501110,Data Scientist,30+ Days Ago,Gforce Consulting Solutions,"Computer vision,Marketing analytics,data science,Risk analytics,Analytical,Demand forecasting,Consulting,Natural language processing",3-8 Yrs,Not disclosed,"Kolkata, Pune, Gurgaon/Gurugram","He / she should be able to mentor junior or associate data scientists / interns <br><br>He / she should be passionate about Data Science / AI/ML with zeal to analyse data,build algorithms to help draw actionable insights to deliver customer delight"
161222501562,Data Scientist,30+ Days Ago,Sapper Software,"Training,Computer vision,Matrix,Architecture,Packaging,model development,Deployment,Downstream",4-8 Yrs,Not disclosed,Pune,"Experience in fine-tuning pre-trained models like BERT,and ELECTRA for downstream tasks such as NER,Classification,etc"
160922502456,Data Scientists,30+ Days Ago,Deeptek,"Computer vision,Medical imaging,Linux,data science,Neural networks,Machine learning,Programming,Manager Technology",3-7 Yrs,Not disclosed,Pune,Experience:Multiple open positions for candidates between 0 and 5 years of experienceEducational Qualification:Bachelors (or higher) degree in a science or engineering discipline<br><br>Practical experience developing predictive models
160622502437,Data Scientist,30+ Days Ago,Diverse Lynx,"Product management,Data analysis,Database,Manager Technology,Research,Project design,management,technology",4-7 Yrs,Not disclosed,Pune,"<div> <div> <ul> <li> Research and develop statistical learning models for data analysis </li> <li> Collaborate with product management and engineering departments to understand company needs and devise possible solutions </li> <li> Keep up-to-date with latest technology trends </li> <li> Communicate results and ideas to key decision makers </li> <li> Implement new statistical or other mathematical methodologies as needed for specific models or analysis </li> <li> Optimize joint development efforts through appropriate database use and project design </li> </ul> </div> "", </div>"
160522501368,Data Scientist,30+ Days Ago,Automationedge,"Training,deep learning,Backend,Linux,Artificial Intelligence,Machine learning,Transformers,Deployment",4-8 Yrs,Not disclosed,Pune,"Working experience with different AI frameworks . Past experience of working in Entity Detection and Disambiguation,Intent Detection,have implemented and worked in industry to solve these problems<br><br>Working experience of CRFs,BERT / Transformers,Text summarization,Attention models,<br><br>Working experience with one of the language models : GPT-2,BERT,ALBERT . ."
150622500890,Data Scientist,30+ Days Ago,Redbixbite,"Training,data science,Machine learning,Data collection,Programming,Data quality,Natural language processing,data visualization",3-5 Yrs,Not disclosed,Pune,"Experience with NLP data models and libraries . Good understanding of entity extraction using NLP . Handson tensorflow,scikit learn,spacy libraries etc . Good knowledge of transfer learning . Good scripting and programming skills in Python and Streamlight . <br><br>Experience with common data science toolkits,such as Python,NumPy,Transformers,Fast.AI,etc"
090922501811,Data Scientist,30+ Days Ago,Accord Consultants,"Computer science,Data analysis,Analytical,Machine learning,Data structures,Data mining,Forecasting,Analytics",8-13 Yrs,Not disclosed,Pune,"Experience in developing Credit based model(s),Risk modelling,Credit scoring,Fraud detection,Causal Analysis,Propensity models,etc<br><br>Bachelor s degree in computer science,data science,mathematics,Statistics or a related field"
090221500139,Data Scientist,30+ Days Ago,Diverse Lynx,"data science,Data Scientist,Data analytics,data,science,analytics",2-7 Yrs,Not disclosed,Pune,<div> <div> <span> <span> </span> </span> <p> <strong> Detailed JD: </strong> </p> <p> 1. Certificate in Data Science </p> <p> 2. Experience in working on some tools for Data Analytics (preference is experience using Maria DB and Graphana. </p> </div> </div>
080423500612,Data Scientist II,30+ Days Ago,Wolters Kluwer,"Computer science,Logistic regression,Data analysis,Operations research,Technology management,Coding,Analytical,Machine learning",4-8 Yrs,Not disclosed,"Kalyani, Pune",Able to perform data manipulation and exploration tasks required to fully evaluate customer characteristics and help the leadership make informed business decisions for assigned projects<br><br> . Help create and maintain a suite of advanced analytical / machine learning libraries that can help detect patterns within our customer data<br><br>Experience . .
070723008130,Technical Lead - Data Scientists,26 Days Ago,Datametica,"Data Science,Natural Language Processing,Data Mining,Machine Learning,Deep Learning,nlp,Data,Machine",5-8 Yrs,"50,000-3 Lacs PA",Hybrid - Pune(Karegaon),"<p>Location: India (Pune)</p><p>Experience: 8 to 12 Years</p><p>We at Datametica Solutions Private Limited are looking for a Lead Data Scientist who has a passion</p><p>for Analytics, A/ML, Cloud, with knowledge and working experience of any cloud platform.</p><p>Responsibilities:</p><ul><li> Liaison with customers on analytics solutions and identify new opportunities.</li><li> Work closely with the Pre-Sales & Business development team to acquire new clients</li></ul><p>for Analytics and creating SOWs, proposals for Analytics solutions</p><ul><li> Responsible for formulating a problem statement and implementing analytical</li></ul><p>solutions by understanding available data and functional requirements.</p><ul><li> Responsible for data and requirements gathering; solution scoping and architecture</li><li> Responsible for managing, developing and maintaining analytics to solve complex</li></ul><p>business problems</p><ul><li> Work closely with Data Scientist team to deliver solutions using advanced statistical,</li></ul><p>machine learning and deep learning techniques</p><ul><li> Ability to generate insights and demonstrate value to customers</li><li> Test various machine learning and analytical tools, build prototypes which can be</li></ul><p>easily scaled up for production deployments</p><ul><li> Experience of working on Cloud Platforms (GCP/Azure) and Cloud Native AI / ML</li></ul><p>Components and services</p><ul><li> Experience of big data technologies and distributed computing concepts will be an</li></ul><p>advantage.</p><ul><li> Excellent Project Management skills with the ability to manage multiple analytics</li></ul><p>projects simultaneously to achieve business results</p><ul><li> Good knowledge of SQL and high level proficiency in R / Python /Pyspark.</li><li> High-level proficiency in statistical, machine, deep learning techniques such as</li></ul><p>regression, Bayesian methods, tree-based learners, SVM, Yolo,LLM architectures etc.</p><ul><li> Excellent Problem solving skills with the ability to translate business objectives into</li></ul><p>analytical frameworks</p><ul><li> Knowledge of Generative AI and experience of using Large Language Models, OpenAI</li><li> Solving use cases with pre-trained architectures.</li><li> Solving use cases with Transfer learning and Meta learning.</li></ul><p>Key Skills Required</p><ul><li> Great communication skills, ability to meet deadlines and prioritize workload</li><li> Demonstrated high degree of organization and ability to manage multiple, competing</li></ul><p>priorities</p><ul><li> Should possess extensive knowledge of and experience in applying data mining and</li></ul><p>machine learning techniques in a project context</p><ul><li> Excellent understanding of machine learning, deep learning, NLP algorithms and</li></ul><p>Recommendation systems.</p><ul><li> Excellent Project Management skills with the ability to manage multiple analytics</li></ul><p>projects simultaneously to achieve business results</p><br /><ul><li> Willingness to try new technologies and languages and ability to grasp and learn</li></ul><p>quicklyStrong Programming Skills in Python / R / PySpark, SQL</p><p>Good To Have Skills</p><ul><li> Experience in ML Ops</li><li> Knowledge and experience of DevOps</li><li> GCP ML Engineer Certification or Microsoft Azure Data Science Certification or equivalent</li></ul><br />"
060123501111,ML Engineer - NLP,30+ Days Ago,Avoma,"Training,deep learning,Usage,Neural networks,Debugging,Machine learning,Python,Natural language processing",2-5 Yrs,Not disclosed,Pune,Develop and improve Deep Learning models in Tensorflow . Work with our engineering team to ship models to our customers . Stay up to date on the latest state-of-the-art papers in NLP . Work with large datasets of over a million documents . Atleast 2 Years of experience with Machine Learning & NLP in a production environment . <br><br>Experience developing and debugging in Python .
