jpb_id,title,posted,company_name,skills,exp,salary,offered_location,job_Description
020823501334,Data Scientist,1 Day Ago,Prescience Decision Solutions,"Computer science,Text mining,Computer vision,SAS,data science,Business analysis,Machine learning,Natural language processing",5-8 Yrs,Not disclosed,Bangalore/Bengaluru,"<ul> <li> As a Data Scientist, you will be working with senior executive clients to understand the business requirements, define the correct problem statement and come up with a framework for the solution. You will also work on the solution and, at times, guide a small team to deliver the same. </li> </ul> <ul> <li> <i> </i> In addition to this, you will also be involved in developing solutions in the areas of Natural Language Processing, Conversational Interfaces, Text Mining, etc. <i> </i> </li> </ul> <strong> Required Skills, Competencies & Experience: </strong> <ul> <li> Good skills in applied statistics, such as distributions, statistical testing, regression, etc. </li> </ul> <ul> <li> Exposure to common data science business problems such as clustering, classification, anomaly detection, prediction, etc. </li> </ul> <ul> <li> Good understanding of machine learning techniques and algorithms </li> </ul> <ul> <li> Experience in Natural Language Processing and Computer Vision </li> </ul> <ul> <li> Experience with common data science toolkits such as Python, R and SAS </li> </ul> <ul> <li> Proficiency in using query languages such as SQL, Hive, etc. and experience with NoSQL databases </li> </ul> <ul> <li> Good scripting and programming skills </li> </ul> <ul> <li> Great communication skills </li> </ul> <ul> <li> Data-oriented personality and excellent business analysis skills </li> </ul> <ul> <li> Experience in building solutions for data science related problems, and working with business stakeholders to define right problem statement and solutions. </li> </ul> <ul> <li> Master s in computer science / statistics / any related field or Bachelor s with equivalent experience </li> </ul> <ul> <li> You must possess an overall work experience of 5-8 years. We are open to applications from professionals who have data analytics / BI background and have then moved to Data Scientist roles. </li> </ul>"
020823010691,Data Scientist,1 Day Ago,Discover Dollar Technologies,"semantic extraction techniques,Time Series Forecasting,NLP techniques,text representation techniques,Python,Tensorflow or PyTorch,Classical & Machine Learning,Pytorch",3-5 Yrs,Not disclosed,"Hybrid - Bangalore/ Bengaluru, Karnataka","Bachelors Degree in a Quantitative discipline <br><br>Experience working with textual / unstructured data with NLP techniques,semantic extraction techniques,data structures and modelling <br><br>Should possess strong problem-solving skills <br><br>Should be proficient in industry standard evaluation metrics<br><br>3+ years experience as a Data Scientist <br><br> . Good to Have"
020823008542,Data Scientist,1 Day Ago,Sankhyana Consultancy Services,"Python,SQL,Data Science,Logistic Regression,Decision Tree,Linear Regression,Pandas,Statistical Modeling",3-8 Yrs,Not disclosed,Bangalore/Bengaluru,Requirement:  . <br><br> Good to have:  . Ability to work collaboratively with cross-functional teams and understand business requirements<br><br>Experience: 3+ years.
020823006412,Data Scientist,1 Day Ago,Scienaptic Systems,"Data Science,Marketing Analytics,Python,Statistical Modeling,Science,Analytics,Modeling,Data",3-6 Yrs,Not disclosed,"Hybrid - Bangalore/ Bengaluru, Karnataka","<p> Responsibilities:<br />• Work with Clients to understand Business Problems, Industry Context, Data Sources,<br />Potential Risks and Constraints & execute the Projects/Tasks Independently.<br />• Translate the Business Program into a solvable Data Science Problem, propose different<br />approaches and their Pros and Cons.<br />• Identify, Analyse and Interpret Trends or Patterns in Complex Data Sets.<br />Build Market Mix Models (MMM), Multi-Touch Attribution Models (MTA), Optimize<br />Marketing Spend and Come Up with Implementable Recommendations and<br />Strategy/Plan.<br />• Good Written, Verbal, and Presentation Skills with the ability to generate and present<br />meaningful Insights.<br />Requirements:<br />• 4-5 Years of Professional Experience in Advanced Data Science focused on, Econometric<br />Modeling, Marketing Analytics, Market Mix modelling, Multi-touch Attribution, Micro<br />Segment Attribution, Unified Measurement, Marketing Budget Optimization, TV<br />Attribution etc.<br />• Ability to Analyse Complex Data and provide Recommendations to Business.<br />• Proficient with Statistical Analysis, AI/ML Algorithms & applying them on Large<br />Datasets.<br />• Establish Scalable, Efficient Solutions for large scale Data Analysis, AI/ML Model<br />Development, AI/ML Model Validation, AI/ML Model Implementation and AI/ML Model<br />Automation (MLOps).<br />• Excellent proficiency in Core Python Fundamentals, Python Programming, and other<br />relevant Python Frameworks (such as Django, Flask etc.), Object Relational Mapper<br />Libraries, Pyspark, Scala & SQL.<br />• Strong Knowledge in AI/ML/DL Techniques, Algorithms, and Tools with exposure to<br />OLS Regression/Multiple Linear Regression, Classification (Logistic Regression, Random<br />Forest, XGBoost), Linear Attribution model, Time Decay Attribution, BG/NBD, Markov<br />Chain, Shapley Additive Explanations, CNN, RNN (LSTM), Transformers (BERT) etc.<br />• Proficiency in working with Open-Source Deep Learning libraries like TensorFlow,<br />Keras, Pytorch.<br />• Demonstrated ability to work Independently.<br />• Proven ability to Visualize Data for Influencing.<br />• Comfortable with Cloud-Based Platforms (AWS, Azure, Google).<br />• Experience in Digital Marketing (Web & App) is a must.<br />• Experience with Google Analytics, Adobe Analytics etc. is a plus.<br />• Proficient in communicating Technical findings to Non-Technical Stakeholders.<br />• Communicate Complex Data or Algorithms into simple Conclusions that will empower<br />Leadership to drive action based on the Insights derived.<br />• Strong Presentation and Communication Skills. </p>"
010823500784,Sr Data Scientist - DSLP,1 Day Ago,Target,"Supply chain,Data analysis,Simulation,Agile,Network security,Data structures,Open source,Technical support",4-8 Yrs,Not disclosed,Bangalore/Bengaluru,"<p> </p><ul> <li> As  <span> a Senior  </span> Data Scientist, you will influence by interacting within the Data Sciences team and with Product teams, perform within the scale and scope of your role by implementing solutions, and contribute to Data Sciences and Target s culture by modeling the culture  </li> <li> Through your understanding of the foundations and working principles of machine learning algorithms, linear algebra, probability theory, statistics, and optimization theory, you will perform data exploration and analysis (look at distributions, find anomalies, create simple visualizations, etc) and implement algorithmic solution given specifications, while adhering to best practices in model development  </li> <li> We will look to you to understand and actively follow foundational programming principles (best practices, know about unit tests, code organization, basics of CI/CD etc) and create a well-maintainable & tested codebase with relevant documentation  </li> <li> You will get the opportunity to develop in one or more approved programming languages (Java, Scala, Python, R), and learn and adhere to best practices in data analysis and data understanding  </li> <li> As you follow agile processes, you will implement prototypes for individual components of software or data science solutions and understand and leverage basic data structures and algorithms in implementing solutions  </li> <li> You will evaluate multiple specified techniques for a defined problem and determine the most appropriate option from a performance perspective  </li> </ul> <p> <b> <span> About you:  </span> </b> </p> <ul> <li> 4-year degree  <span> in Quantitative disciplines (Science, Technology, Engineering, Mathematics)  </span> or equivalent experience  </li> <li> <span> 3+ years of professional experience or equivalent industry experience  </span> </li> <li> <span> Good knowledge and experience developing optimization, simulation and statistical models  </span> </li> <li> <span> Strong analytical thinking skills. Ability to creatively solve business problems, innovating new approaches, where required  </span> </li> <li> <span> Strong hands-on programming skills in Python, SQL, Hadoop/Hive. Additional knowledge of Spark, Scala, R, Java desired but not mandatory  </span> </li> <li> <span> Good working knowledge of mathematical and statistical concepts, MILP, algorithms and computational complexity  </span> </li> <li> <span> Passion for solving interesting and relevant real-world problems using a data science approach  </span> </li> <li> <span> Experience in implementing advanced statistical techniques like regression, clustering, PCA, forecasting (time series) etc.  </span> </li> <li> <span> Able to produce reasonable documents/narrative suggesting actionable insights  </span> </li> <li> <span> Excellent communication skills. Ability to clearly tell data driven stories through appropriate visualizations, graphs and narratives  </span> </li> <li> <span> Self-driven and results oriented; able to meet tight timelines  </span> </li> <li> <span> Strong team player with ability to collaborate effectively across geographies/time zones  </span> </li> </ul>"
010823500783,Sr Data Scientist - DSLP,1 Day Ago,Target,"Business analytics,Analytical,SCALA,Agile,test driven development,Calculus,Weaving,SQL",4-8 Yrs,Not disclosed,Bangalore/Bengaluru," Use your skills,experience and talents to be a part of groundbreaking thinking and visionary goals,while we support your development to grow as a Data Scientist within Target s Data Sciences team . As a . Sr Data Scientist in DSLP . .,"
270722500042,Data Scientist / Decision Scientist,30+ Days Ago,Maruti Suzuki,"Cloud computing,data science,Neural networks,Machine learning,Programming,Telematics,data visualization,Automotive",2-6 Yrs,Not disclosed,Bangalore/Bengaluru,Hands on experience in unsupervised machine learning algorithms<br><br>Working experience with Cloud Computing Platforms such as AWS / IBM Strong programming skills in python is a must<br><br>Essential: Must have minimum of 3 years of industry experience in developing data science models<br><br> . Technical Skills / Experience <br><br>Experience using machine learning algorithms (e.g
210723005031,Data Scientist,12 Days Ago,MothersonSumi INfotech & Designs (MIND),"Data Science,Artificial Intelligence,Machine Learning,Statistics,Deep Learning,Predictive Modeling,Tensorflow,pandas",3-6 Yrs,Not disclosed,"Noida, Uttar Pradesh",Bachelors/ masters degree in computer science/ Mathematics/ Statistics or Related Field <br><br>Thorough knowledge of algorithmic principles and concepts behind Models . Technical Skillset as detailed below: . Must have:  Python<br><br>3 to 6 Years Hands-on experience in a professional role building Data Science products <br><br> Good to have:  Computer Vision
200723004439,Sr. Data Scientist,13 Days Ago,Info Edge,"machine learning,Tensorflow,Cnn,Decision Tree,Logistic Regression,Lstm,Artificial Intelligence,Text Analytics",2-6 Yrs,Not disclosed,"Hybrid - Noida, Uttar Pradesh(Sector-132 Noida), Delhi / NCR",Required Educational Qualification: PhD/ MTech / BTech with relevant experience from Tier 1 Campus <br><br>Identify potential data-driven machine learning solutions to improve user experience through personalization and prediction of user preferences<br><br> Desired Experience: 1-5 Years
020823502534,Manager - Data Scientist,1 Day Ago,SBI Card,"Turbine,Deployment,Scientist 1,Cost control,Inventory,Cost,Control,Data",3-7 Yrs,Not disclosed,Gurgaon/Gurugram,<p> 1. Develop customized scorecards for all kind of interventions in customers credit lifecycle <br /> 2. Develop self cure models for customized collection interventions cost control <br /> 3. Develop micro segments for effective portfolio interventions to maintain acquisition quality <br /> 4. Develop transaction level scorecards as input to the authourization strategy and cross-sell qualifiation <br /> 5. Develop application fraud prevention scorecard  <br /> 6. Develop propensity models for offering hardship programs  <br /> 7. Develop customized acqusition scorecards for assigned segments. <br /> 8. Develop customized behaviour scorecards for each assigned segment. <br /> 9. Maintain inventory of assigned models <br /> 10. Automate ensure model deployment either in credit fraud decision engines or turbine/data lake </p>
130723501009,Data Scientist,20 Days Ago,DUN BRADSTREET INFORMATION SERVICES INDIA PRIVATE LIMITED,"Data analysis,data science,Analytical,Machine learning,HTML,Monitoring,Financial services,SQL",5-8 Yrs,Not disclosed,Hyderabad/Secunderabad," . 5 to 8 years of relevant experience in Data Analytics / Data Science / Model Validation roles . Strong programming skills in tools such as Pyspark,Python,R,SQL to manipulate data and conduct statistical analysis . <br><br>Experience in BFSI domain / Statistical Modelling & Validation is an added advantage . Ability to interpret and translate data into meaningful business insights ."
270123500019,Data Architect/LDS,30+ Days Ago,Cyient,"Data analysis,Semiconductor,Aerospace,Machine learning,Healthcare,Data mining,SQL,Python",10-15 Yrs,Not disclosed,Hyderabad/Secunderabad,"<p> </p> <p> </p> <p> </p> <p> </p> <ul> <li> Should have 10-15 years hands-on experience in algorithms and implementation of analytics solutions in predictive analytics, text analytics and image analytics </li> <li> Expected to contribute to opportunity analysis, building project proposals, designing, implementation and execution across variety of ML projects in the areas of Predictive Modelling, Forecasting and Optimization </li> <li> Should have 5-10 years of experience in leading a team of data scientists, works closely with client s technical team to plan, develop and execute on client requirements providing technical expertise and project leadership.  </li> <li> Manage data science work streams and eventually build a team of data scientists, ML experts and data engineers to solve business problems by applying advanced Machine Learning algorithms and complex statistical models on large volumes of data. </li> <li> Work closely with product managers, software engineers, and infrastructure engineers to define strategy, roadmap and requirements </li> <li> Experience with information retrieval, Natural Language Processing, Natural Language Understanding and Neural Language Modeling. </li> <li> Ensure the data science team successfully delivers on design, development, testing, experimentation, and the operations of algorithms, data pipelines, and systems </li> <li> Follow industry best practices, stay up to date with and extend the state of the art in machine learning research and practice, drive innovation by contributing towards publications and patents. </li> <li> Regularly communicate with senior management on status, risk and strategy </li> <li> Collaborate to develop analytics pipelines in production systems around continuous integration and learning. </li> <li> Propose suitable technology stacks for projects to be deployed across cloud platforms and on-premises infrastructure. </li> <li> Evaluates and leads broad range of forward looking analytics initiatives, track emerging data science trends, and knowledge sharing </li> <li> Helps in new project proposals with advanced analytic architectures across functional areas as per requirement/opportunities. </li> <li> Participate in internal technical councils and represent the organization in forums that involve community of data scientists across industry and academia. </li> </ul> <p> </p> <div> <strong> Technical Role and Responsibilities </strong> </div> <ul> <li> Demonstrated strong capability in statistical/Mathematical modelling or Machine Learning or Artificial Intelligence </li> <li> Demonstrated skills in programming for implementation and deployment of algorithms preferably in Statistical/ML based programming languages in Python </li> <li> Experience leading enterprise-wide data science projects from scratch to scale </li> <li> Significant record of publications, exhibiting influence within an industry </li> <li> Sound Experience with traditional as well as modern statistical techniques, including Regression, Support Vector Machines, Regularization, Boosting, Random Forests, and other Ensemble Methods </li> <li> Highly proficient in Python, R, SQL, Spark, and other big data tools </li> <li> Visualization tool experience - preferably with Tableau or Power BI </li> <li> Sound knowledge of cloud ecosystems like Azure, AWS and Google cloud. </li> <li> Provide technical recommendations and engage with ETL/BI Architects, Business SMEs and other stakeholders throughout the Solution/Data Architecture and implementation lifecycle and recommend effective solutions to develop high performance and highly scalable data solutions (data marts/warehouse and data mining and advanced analytics) </li> <li> Experience in Big Data technologies like Hadoop, Spark, Hive, Pig, Presto, Cassandra, Kafka and NoSQL databases. </li> <li> Data analysis, reporting, visualization expertise and experience with tools such as Tableau, Alteryx, Python and R in scale. </li> <li> Carrying out statistical and mathematical modelling, solving complex business problems and delivering innovative solutions using state of the art tools and cutting-edge technologies for big data & beyond. </li> <li> Good understanding about statistics - hypothesis testing, p-values, confidence intervals, regression, t-test, f-test and ANOVA </li> <li> Domain experience in Storage, File systems, hybrid cloud environments is a plus. </li> <li> A critical thinker that can quickly understand a new problem space and apply analytic techniques to identify potential value </li> <li> Demonstrated thought leader with an interest in working on Digital Industrial transformation </li> <li> Ability to evaluate quality of ML models and to define the right performance metrics for models in accordance with the requirements of core platform </li> <li> Assist senior management in making key business decisions </li> <li> Experience in interpreting and communicating analytic results to analytical and non-analytical business partners and executive decision makers in a lucid, precise, clear way </li> <li> Strong knowledge on scalable ML model deployments with proficient experience on different tools like dockers, Azure, MLflow, Sagemaker and Kubernetes </li> </ul> <p> </p> <div> <strong> Education  </strong> </div> <ul> <li> Required to have Bachelors/Masters/Ph.D. in Statistics/Machine Learning/Data Science/Analytics /Computer Science or Engineering from premier institutes </li> <li> Preferred to have PhD in Data Science/Analytics/Computer Science from premier institutes </li> <li> Preferred to have certifications in cloud technologies </li> <li> Preferred specialization in the fields of statistics, condition-based-maintenance, predictive modeling, or AI/ML techniques. </li> <li> Good to have research publications (in reputed journals) / patents in the area of data science. </li> </ul> <p> </p> <p> </p> <p> <b> Skills & Experience </b> </p> <ul> <li> Advanced Analytics, Big Data Technologies, Data Pipelines, Machine Learning Algorithms </li> </ul>"
080623502307,Sr. Data Scientist,30+ Days Ago,Blue Yonder,"Translation,Machine learning,Windows,Test cases,Research,Operations,Supervision,Testing",5-9 Yrs,Not disclosed,Hyderabad/Secunderabad,"<p> Consistently delivers solid quality and helps the team, in particular: </p> <p> Is responsible for designing, developing, and testing new algorithms, models, or solving approaches based on machine learning, operation research, or other techniques to solve a Blue Yonder business problem under the supervision of a senior team member or manager. </p> <p> Stays current with scientific libraries and development tools. </p> <p> Continuously improves themselves and the code they produce. </p> <p> Develops quality software according to clean code principles and Blue Yonder standards. </p> <p> Has an understanding of the problem domain the team works on. </p> <p> Is perceived as the expert in a small area within the team and is the go-to person for related implementational and operational issues. </p> <p> Participates in the operation of machine learning services through rolling out changes, resolving incidents, and fulfilling service requests. </p> <p> Clearly communicates impediments and actively seeks support by team members to overcome obstacles. </p> <p> </p> Secondary Duties and Responsibilities  <p> Participates in team activities such as backlog grooming, planning, daily standups, and retrospectives. </p> <p> Demonstrates problem solving and innovation ability. </p> <p> Integrates new models and algorithms into a product solution with limited assistance. </p> <p> Translates business requirements to user stories and actively seeks feedback by the stakeholders. </p> <p> Timely and proactively communicates impediments to commitments. </p> <p> Communicates information in the team. </p> <p> Communicates information internally and assists in external communication with customers and partners. </p> <p> Acts according to company and team visions and requires user stories to adhere to those visions. </p> <p> Writes effective test cases. </p> <p> Has mastered some of Blue Yonders domain expertise with knowledge acquired from past projects. </p> <p> Actively provides feedback during code reviews. </p> <p> Understands functional and technical requirements of software components. </p> <p> Participates in translating scientific contributions into patents, publications, or conferences. </p> <p> Autonomously pulls issues from the team backlog or supports other team members with their issues as appropriate. </p> <p> Participates in team hiring activities. </p> <p> Understands infrastructure costs of machine learning algorithms embedded in delivered products and services and makes diligent use of provided resources. </p> <p> Identifies inefficient use of computational resources in the machine learning pipeline and uses adequate patterns and technologies to resolve this. </p> <p> Scales machine learning pipeline to meet throughput targets and time windows. </p>"
190723501719,Data Scientist,14 Days Ago,Vertiv Co,"Machine learning,Data collection,data visualization,Collections,Data,Machine",4-7 Yrs,Not disclosed,Pune,"<ol> <li> Undertaking data collection, preprocessing and analysis </li> <li> Building models to address business problems </li> <li> Presenting information using data visualization techniques </li> <li> Identify valuable data sources and automate collection processes </li> <li> Undertake preprocessing of structured and unstructured data </li> <li> Analyze large amounts of information to discover trends and patterns </li> <li> Build predictive models and machine-learning algorithms </li> <li> Combine models through ensemble modeling </li> <li> Present information using data visualization techniques </li> <li> Propose solutions and strategies to business challenges </li> <li> Collaborate with engineering and product development teams </li>  </ol>"
300523501155,Python and ML Trainer,30+ Days Ago,Thescholar,"Training,deep learning,Version control,GIT,MIN,Linux,Django,Machine learning",3-8 Yrs,Not disclosed,"Hyderabad/Secunderabad, New Delhi, Pune, Gurgaon/Gurugram, Bangalore/Bengaluru","Eligibility: Graduate with minimum 3 year experience in Python/ ML Industry/ Training experience . Strong problem-solving skills . Hands-on experience with Python3 . Understanding of version control Git and Linux Fundamentals . <br><br>Required Experience,Technical Skills and Qualifications:  . <br><br>Experience with building Machine Learning solutions with Python ."
180123010571,Data Scientist,28 Days Ago,Innominds Software,"Cloud,Python,Artificial Intelligence,machine learning,Deep Learning,Machine,Data,Intelligence",7-12 Yrs,14-24 Lacs PA,"Hybrid - Hyderabad/Secunderabad, Pune, Bangalore/Bengaluru","Should have experience in Neural Networks,TensorFlow,Kesar <br><br>Should have experience in leveraging cloud-based services<br><br>Should have excellent communication skills both verbal and written with strong urge to learn,iterate and innovate<br><br>Should have ability to engage with client stakeholders at multiple levels and provide solutioning"
311022501849,Senior Data Scientist,30+ Days Ago,Savantys Solutions,"deep learning,Neural networks,Pharma,Analytical,SAAS,Healthcare,Forecasting,Statistics",5-10 Yrs,Not disclosed,"Hyderabad/Secunderabad, Pune, Bangalore/Bengaluru","Should be able to implement solutions for industries e.g<br><br> 3+ years of experience using analytical tools / languages like Python R on large scale data Strong conceptual understanding of analytics framework and algorithms such as regression and classification techniques,boosting,gradient descent,Forecasting,Clustering,Decision trees etc"
