jpb_id,title,posted,company_name,skills,exp,salary,offered_location,job_Description
270623009563,Data Scientist,1 Day Ago,Darshan Softech (DSPL),"data science,Quantitative Analysis,data analysis,data mining,predictive modeling,statistical modeling,Statistical Analyses,sql",5-8 Yrs,12-18 Lacs PA,Vadodara,"Bachelors degree in a highly numerate discipline - Mathematics,Statistics,Computer Science or similar <br><br>4+ years experience in data science <br><br>Advanced pattern recognition and predictive modelling experience <br><br>Experience with Excel,PowerPoint,SQL and programming languages <br><br>SQL expert and a good understanding of databases,data relationships and data integrity"
270123500834,Data Scientist / Sr. Data Scientist,30+ Days Ago,Fratitude Talent Advisors,"Graphics,Data analysis,data science,Machine learning,Data collection,PHP,Sensors,Research",7-9 Yrs,Not disclosed,Bangalore/Bengaluru,"<div> <div> <div> <strong> Qualification: </strong>  Bachelor s degree in Mathematics, Statistics, Computer Science or a related discipline </div> </div> <div> <div> <div> <div> <div> <p> <strong> Experience: </strong>  7 plus years with 3-5 years of experience in statistical analysis or data science. </p> <p> <strong> Skills:  </strong> Python, R, PHP, Hadoop/Big data, Data Science/Data Analytics, Mathematics, Statistics, Algorithms and probability engines </p> <ul> <li> Experience manipulating large datasets and using databases with experience in general purpose programming language such as Hadoop. </li> <li> Ability to develop solutions to loosely defined business or research problems by leveraging pattern detection over large data sets. </li> <li> Experience using machine learning algorithms. </li> <li> Strong interpersonal skills with the ability to communicate with technical and non-technical internal and stakeholders. </li> <li> Ability to organize, analyze and correlate data information. </li> </ul> <p> <strong> </strong> </p> <p> <strong> Role & Responsibilities: </strong> </p> <ul> <li> Construct advanced predictive models, algorithms and probability engines to support data analysis or product functions; verify model and algorithm effectiveness based on real-world results. </li> <li> Design experiments and methodologies to generate and collect data for business use. </li> <li> Identify what data is available and relevant, including internal and external data sources, leveraging new data collection processes such as sensors, open data, and social media feeds. </li> <li> Design experiments, test hypotheses, and build models to explore complex business and safety science systems. </li> <li> Conduct data analyses using traditional and complex statistical methods. Design algorithms and implements software to perform analyses. </li> <li> Aggregate, transform and integrate multiple data sets to test hypothesis, model complex systems and identify patterns. Prepare and analyze program/model output to allow for efficient data analysis. </li> <li> Transform complex data and results into creative graphs, tables, charts and other graphics to present and/or share the data in a compelling and concise manner. </li> <li> Write methodology, analysis and data insights for research papers, proposals and presentations. Synthesize all aspects of a data science project to lead non-technical audiences through the goals, methods and implications of the project. </li> <li> Work with business leaders and researchers to suggest other projects and initiatives that will advance the organizations goals. </li> </ul> </div> <div> </div> </div> </div> </div> </div> </div>"
260523500007,Data Scientist,30+ Days Ago,Hakimo,"tableau,data science,SQL database,Security systems,Physical security,Management,Data warehousing,Python",3-5 Yrs,Not disclosed,Bangalore/Bengaluru,3+ years of professional experience as a data scientist or related role . Strong knowledge of Tableau . <br><br>Knowledge of data science algorithms and experience with implementing them on large-scale data . <br><br>Experience working with Python
250121500977,Data Scientist,30+ Days Ago,Intuitor SoftTech Services Pvt. Ltd.,"Computer science,Telecom,IIS,Data collection,Agile,Data structures,Predictive modeling,Data mining",5-7 Yrs,Not disclosed,Bangalore/Bengaluru,"<p> We are a fast growing Managed Service Provider with some of the leading Global Enterprises/Telecom Service Providers as our clients. We are in the process of expanding our India Operations and looking for an experienced Data Scientist professional to join our team. </p> <p> <strong> Role and Responsibilities  </strong> </p> <ol> <li> Work on the DS/ML requirements of the business from ground up. </li> <li> Ability to work and deliver results independently. </li> <li> Data mining using state-of-the-art methods and tools. </li> <li> Enhancing data collection methods to include information that is relevant for building analytic systems. </li> <li> Set in motion data gathering process and assess the effectiveness and accuracy of new data sources and gathering techniques. </li> <li> Apply statistics skills, such as distributions, statistical testing, regression,etc. </li> <li> Develop custom data models and algorithms to apply to data sets. </li> <li> Implement models and monitor outcomes. </li> <li> Use predictive modeling to increase and optimize business outcomes. </li> <li> You will be working on the following use cases </li> </ol> <li> Anomaly / outlier detection </li> <li> Deduplication & Entity extraction </li> <li> Correlation & Cause analysis </li> <ul> <li> 5-7 years of experience in relevant field. </li> <li> Knowledge of base machine learning model and deep learning technologies. </li> <li> Experience with building applications in programming languages such as Python/Java, deep knowledge RDBS. </li> <li> Experience with building ML models using frameworks such as TensorFlow, PyTorch, Keras. </li> <li> Should have worked with CloudFront, Algorithms & data structures. </li> <li> Experience with software development best practices such as version control technologies, agile. </li> <li> Research mindset and math-oriented expertise. </li> <li> Master s Degree in Computer Science or related field Ability to prioritize, manage time well, stay organized, quickly address needs and adjust focus as needed. </li> <li> Quick learner, with a positive attitude and ability to work well within a team </li> </ul> <p> <strong> Skills good to have- </strong> </p> <ul> <li> Basic understanding of web and client-server architecture. </li> <li> Experience working with infrastructure operations data and AIOPs work would be an added advantage. </li> <li> Understanding of Big Data, understanding of difference between MapReduce and in-memory processing. </li> <li> SQL, NoSQL, Pig, Hive, MongoDB, Cassandra & Data lake. </li> <li> Azure ( app func, storage, event hub, keyvault, k8s). </li> <li> Graph database ( janusgraph). </li> <li> Docker, Kubernetes, Kubeflow & Bash. </li> <li> Data visualisation tools, such as D3.js, GGplot, etc. </li> <li> Understanding of popular ITSM and CMDB tools. </li> </ul>"
231019500034,Data Scientist,30+ Days Ago,Xebia It Architects,"Mining,Text mining,Logistic regression,Machine learning,Data mining,Continuous improvement,Open source,Forecasting",8-10 Yrs,Not disclosed,Bangalore/Bengaluru,"<p> We won't track your information when you decline. But in order to comply with your preferences, we'll have to use just one tiny cookie so that you're not asked to make this choice again. </p><p> <span> As a data scientist in our team we expect you to lead engagements with our customers. <span> <span> <span> Identify potential opportunities in applying Data Mining methods & techniques to solve existing business problems <span> <span> <span> <span> </span></span></span></span></span></span></span></span></p><li> <span> Highlight both risks & business benefits in using Data driven approaches <span> </span></span></li><li> </li><li> <span> Put across a roadmap for customers & also highlight technology requirement <span> </span></span></li><li> </li><li> <span> Define scope, effort & risks in project engagements & lead execution in small team <span> </span></span></li><li> </li><li> <span> Actively consult, conduct pre - sales, develop POCs, patriciate incubationacceleratorproduct programmes <span> </span></span></li><li> <span> Introduce and follow good development practices, innovative frameworks, and technology solutions that help business move faster. <span> <br /> <span> <span> <span> Work with cross functional teams effectivel <span> <ul> <li> <span> Good knowledge of advanced statistical methods. Mine and analyze data, applying statistical methods as necessary, pertaining to customers discovery and viewing experiences to identify critical product insights. <span> </span></span></li><li> </li><li> <span> Experience in creating statistical models andor optimization frameworks for improving processesproductsprofits <span> </span></span></li><li> </li><li> <span> Should possess working knowledge of visualization concepts along with any one of the software like Tableau, Shiny, Spot fire or D3 - JS <span> </span></span></li><li> </li><li> <span> Knowledge in Text Mining, Semantic Web, elastic search, Amazon cloud, would be an added advantage. <span> </span></span></li><li> </li><li> <span> Experience on Big Data implementation with Big data work flows MapR, Cloudera, Hortonworks, Kafka, Spark, Sqoop, HDFS - Hive etc, <span> </span></span></li><li> </li><li> <span> Translate analytic insights into concrete, actionable recommendations for business or product improvement. <span> </span></span></li><li> </li><li> <span> Partner closely with business and engineering leaders throughout the lifecycle of project. Ensure that necessary data is captured; analytic needs are well - defined up front and coordinate the analytic needs. <span> </span></span></li><li> </li><li> <span> Should have independently handled a project technically and provided directions to the other Team Members. <span> </span></span></li><li> </li><li> <span> Able to persuade stakeholders and champion effective techniques through development. <span> </span></span></li><li> </li><li> <span> Strong interpersonal and communication skills: ability to tell a clear, concise, actionable story with data, to folks across various levels of the company. <span> </span></span></li><li> </li><li> <span> Demonstrating thought leadership and subject matter expertise in all relevant topics by coming up with papers, publications and Patents <span> </span></span></li><li> </li><li> <span> Adapt communications and approaches to conclude technical scope discussions with various Partners, resulting In Common Agreements. <span> </span></span></li><li> </li><li> <span> Experience working with tight deadlines <span> </span></span></li><li> </li><li> <span> Have suitable qualifications and industry certifications <span> </span></span></li><li> <ul> <span> <br /> Skills we're looking for <span> <li> <span> Expertise with one of the following scripting languages; <span> </span></span></li><li> </li><li> <span> Python, R, Knime, Mat - lab, Java, Mat - labOctave <span> </span></span></li><li> <span> Hadoop ecosystem, H2o, elastic search, spark <span> </span></span></li><li> <span> Tech savy and willing to work with open - Source Tools <span> </span></span></li><li> </li><li> <span> Proven track record and experience with statistical modelingdata mining algorithms such as <span> </span></span></li><li> </li><li> <span> Multivariate Regression, Logistic Regression, clustering algorithms, Support Vector Machines, Decision Trees etc <span> </span></span></li><li> </li><li> <span> Machine learning, deep learning and graph mining. <span> </span></span></li><li> <span> DOE, Forecasting, Segmentation, Uncertainty Analysis etc. <span> </span></span></li><li> <span> Data Mining i.e. Text Mining, Classification Methods SVM, NN, etc <span> </span></span></li><li> <span> Vector Space model for Unstructured Text <span> <span> Sentiment Analysis, Association Mining <span> </span></span></span></span></li><li> <span> Human computer interaction speech, voice, emotions, etc. <span> </span></span></li><li> <span> 8 - 10 years with 2+ years of MS or PhD <span> <span> banking domain, fintech, automotive, retail, e - commerce, airlines. <span> <span> We thrive for authority. This can only be achieved by working with the  <span> <span> projects and create a  <span> <span> All this is in place so you can accelerate your career. <span> <span> The most challenging assignments <span> <p> <span> At Xebia you find like - minded colleagues who are forerunners in their field, are used to get customer organizations moving and have the courage to leave the beaten track. By sharing knowledge with customers and communities, we constantly broaden our expertise and decide what the next cool thing is to work on. <span> </span></span></p><p> <span> We challenge you to accelerate your personal development. Curious We like to tell you more or invite you to one of our events!  <span> </span> </span> </p> </span> </span> </span> </span> </span> </span> </span> </span> </span> </span> </span> </span>   </li> </span> </span>                         </ul> </li>                             </ul> </span> </span> </span> </span> </span> </span> </li>"
230623605111,Data Scientist,30+ Days Ago,Talent  Corner HR Services Pvt Ltd,"Tensorflow,Pytorch,CNN,NLP,Data Scientist,Structured Data,Data,Natural language processing",5-10 Yrs,15-25 Lacs PA,Bangalore/Bengaluru,"Hands-on experience with Graph DB (Neo4J) etc<br><br>At least 5 years of hands-on experience in various models on NLP,CNN,RNN,LSTM,Transformer based Clustering,Reinforcement Learning,Regression,etc. Desired Candidate Profile"
230623501281,Data Scientist,30+ Days Ago,Skillety,"C++,Data modeling,Staffing,GCP,Database management,Programming,Data structures,Perl",12-15 Yrs,Not disclosed,"Gurgaon/Gurugram, Bangalore/Bengaluru",Development experience on GCP (Big query and Vertex AI) and good to have AWS knowledge as well<br><br> Good to have database management and administration knowledge
230421500365,Senior Data Scientist,30+ Days Ago,MMS Holdings,"Graphics,Computer science,PDF,Simulation,Project management,Pharma,Machine learning,Javascript",3-7 Yrs,Not disclosed,Bangalore/Bengaluru,"Bachelors in Engineering,Statistics or Computer Science with 5 or more years related work experience or a Masters degree with typically 3 or more years or a PhD degree or an equivalent combination of education and experience . Understanding of CROs and/ or Health Systems and scientific clinical data / terminology,the drug development process ."
230223500423,Sr. Data Scientist,30+ Days Ago,Skillety,"Unix,Linux,Staffing,Time management,Project management,Analytical,data visualization,Bioinformatics",10-15 Yrs,Not disclosed,Bangalore/Bengaluru, . Strong R / Python programming skills and work experience in Unix / Linux environment . Good computational and data visualization capability / experience to aid results interpretations . <br><br> . Interdisciplinary experience especially at intersection of computational and scientific disciplines . .
230223500417,Data Scientist - Healthcare Analytics,30+ Days Ago,Skillety,"Staffing,Machine learning,Programming,healthcare analytics,Troubleshooting,Analytics,Reporting tools,SQL",12-15 Yrs,Not disclosed,Bangalore/Bengaluru," . Proficiency in one or more modern programming languages (Python) . Creative Problem solving and troubleshooting skills<br><br>Working experience in statistical techniques,Machine Learning,text analytics / NLP,and reporting tools<br><br>Experience in using Azure or / and AWS stack is desired"
221118500045,Data Scientist / Advanced Analytics - Machine Learning,30+ Days Ago,E2E Infoware,"advanced analytics,deep learning,Artificial Intelligence,R Programming,Machine learning,Python,analytics,machine",1-5 Yrs,Not disclosed,"Chennai, Bangalore/Bengaluru","Data Scientist /  Advanced Analytics - Machine Learning,  Python,  Predictive Analysis,  Statistical Learning,  Artificial Intelligence,  Deep Learning,  CNN,  RNN and R Programming. 

Location : Bangalore, Chennai."
220822501650,R Programmer,30+ Days Ago,Global Talent Pool,"deep learning,Data analysis,Backend,data science,R Programming,Data Analyst,Business solutions,Monitoring",5-7 Yrs,Not disclosed,"Vijayawada, Bangalore/Bengaluru","Experience in Finance,R-Studio / Shiny. ."
220423500849,NLP Data Scientist,30+ Days Ago,Ringcentral,"Training,Mediclaim,Analytical,Cloud,Video conferencing,Wellness,Transformers,Cost",2-7 Yrs,Not disclosed,Bangalore/Bengaluru,"Excellent communication and teamwork skills . Bachelors or Masters degree in Computer Science or a related field. <br><br>with a minimum of 2 years of experience in NLP,who is passionate about exploring and utilizing the latest developments in NLP space <br><br>Experience in developing and deploying NLP models in production environment . ."
220223501607,Manager - Data Science,30+ Days Ago,Digit88,"Product engineering,Project management,Analytical,Business analytics,Consulting,Billing,Business intelligence,Forecasting",5-7 Yrs,Not disclosed,Bangalore/Bengaluru," . Bachelors degree in Business,Computer Science,Computer Information Systems,Engineering,Mathematics,or other business / analytical disciplines<br><br>Experience in the utility or energy industries"
211122502556,Sr . Data Scientist,30+ Days Ago,ORMAE (Operations Research Machine learning & Analytics Experts LLP),"Computer science,Operations research,data science,Analytical,Demand forecasting,Machine learning,Data structures,Forecasting",3-10 Yrs,Not disclosed,Bangalore/Bengaluru,"Minimum 2-year Experience with Time-Series forecasting and recommender system<br><br>Experience in applied statistics,predictive analytics,demand forecasting,data science,machine learning algorithms in real-world projects <br><br> Good background in data structures,graph theory,object-oriented programming"
210423501695,Data Scientist III,30+ Days Ago,Equinix,"Computer vision,github,GIT,Statistical analysis,Coding,Machine learning,Cloud,Workflow",2-7 Yrs,Not disclosed,Bangalore/Bengaluru,"Apply cutting-edge technologies and toolchains in big data and machine learning to build a machine learning platform on Cloud (ML ops) . Building Features,running tests,performing statistical analysis,and interpreting test results . Proficient in any of the deep learning frameworks such as PyTorch,TensorFlow,Keras . <br><br>Experience coding in Python (needed) . ."
210223500864,Data Scientist,30+ Days Ago,Techneplus Software,"Computer science,SAS,Process improvement,Machine learning,Resource allocation,data visualization,Data mining,Analytics",3-8 Yrs,Not disclosed,"Noida, Bangalore/Bengaluru","Bachelor s degree in Mathematics,Computer Science,Data Science,Applied Statistics,or a related field,Master s preferred<br><br>Experience analyzing large,complex data sets yielding opportunities for revenue and / or process improvement within an organization . . . . Ability to problem solve and identify creative solutions<br><br>Programming experience (SQL,R,Python) required"
200822500570,Data Scientist,30+ Days Ago,Add On It Systems,"PDF,Statistical analysis,Machine learning,MS Word,data visualization,Python,statistics,microsoft",2-4 Yrs,Not disclosed,Bangalore/Bengaluru,Experience with python <br><br>Experience with ETL <br><br>Experience with Statistical Analysis
200123500102,Data Scientist-Health Care Analytics,30+ Days Ago,Skillety,"Staffing,Machine learning,Programming,Troubleshooting,big data,Reporting tools,SQL,Python",5-12 Yrs,Not disclosed,Bangalore/Bengaluru,"Master s or Bachelor s degree in Computer Science or STEM (Science,Technology,Engineering,and Mathematics) or MBA with strong fundamentals and problem-solving skills . 12 -15 years of experience in the Analytics industry with Medical analytics<br><br> Proficiency in one or more modern programming languages (Python) . Creative Problem solving and troubleshooting skills"
181220500116,Data Scientist,30+ Days Ago,Unusual Hire,"advanced analytics,RDBMS,Analytical,Machine learning,power bi,QlikView,data visualization,Business intelligence",2-4 Yrs,Not disclosed,Bangalore/Bengaluru,"In this role,you should be highly analytical with a knack for analysis,math and statistics<br><br>Knowledge of Power BI,tableau,QlikView is preferred . Good experience in Power Point presentations is preferred . ."
180321501105,Data Scientist,30+ Days Ago,Sony,"Backend,Data analysis,C++,Data management,Business analytics,Data processing,Data mining,Business intelligence",4-9 Yrs,Not disclosed,Bangalore/Bengaluru,"Should be able to monitor data quality,devise processes and mechanisms to cleanse the data wherever required<br><br>Should have ability to build automation needed for effective labelling of the data,perform data preparation,data augmentation where required to make the artificial intelligence components more accurate and beneficial. <br><br>Experience using business intelligence tools (e.g"
171122502642,Senior Data Scientist,30+ Days Ago,Locus It Services,"Data analysis,SAS,Coding,Machine learning,Perl,Ruby,Analytics,SQL",6-11 Yrs,Not disclosed,Bangalore/Bengaluru,"6+ years as data scientist and technical hands-on coding experience<br><br> . Have experience in Machine Learning / AI techniques including Deep learning (RNN,CNN,GAN,etc),Support Vector Machines<br><br> . Have experience in Parallel programming frameworks for GPUs,TPUs and developed containerized solutions (Docker / Mesos etc)"
170523501111,Data Scientist,30+ Days Ago,Gforce Consulting Solutions,"tableau,data science,spark,Demand forecasting,Machine learning,Data structures,Object oriented programming,Statistics",3-8 Yrs,Not disclosed,Bangalore/Bengaluru,"<div> <div> <ul> <li> Experience in Python, R, Spark, SQL, Mongo DB and D3.js / Tableau </li> <li> Strong in Applied Statistics, Predictive Analysis, Demand Forecasting, Regression, Forecasting Techniques </li> <li> Exposure in Data Science, Machine Learning Algorithms </li> <li> Data Structures, Object Oriented Programming </li> </ul> <div> </div> </div> </div>"
170423501973,Senior Data Scientist,30+ Days Ago,KAS Services India,"Supply chain,advanced analytics,Operations research,data science,Analytical,Machine learning,Agile,Analytics",4-6 Yrs,Not disclosed,Bangalore/Bengaluru," . MS or PH.D. in Computer Science,applied mathematics,statistics,physics,operations research,quantitative social sciences or related fields,Mandatory Formal Education / Qualifications e.g<br><br>Expertise in tools required to execute a data science project - SQL,Python,R,ML algorithms . <br><br> . Desired qualification and work experience"
170223503901,ML Lead,30+ Days Ago,Kpisoft Technologies,"Training,OOAD,Social media,Machine learning,Linguistics,Natural language processing,Analytics,Python",2-7 Yrs,Not disclosed,Bangalore/Bengaluru,2 years experience as a Sr ML / NLP Engineer or similar role . . . . Hands-on in machine learning frameworks (like TF+Keras or PyTorch or Spark+h2o) and libraries (like scikit-learn and pandas) . . .
160921501150,Data Scientist,30+ Days Ago,Aeries Technology,"Computer science,Simulation,Coding,Consulting,Javascript,HTTP,Data mining,Information technology",5-7 Yrs,Not disclosed,Bangalore/Bengaluru,"Experience using web services: Redshift,S3,Spark,etc<br><br> A drive to learn and master new technologies and techniques<br><br>Experience creating and using advanced machine learning algorithms and statistics: regression,simulation,scenario analysis,modeling,clustering,decision trees,neural networks,etc<br><br>Experience using statistical computer languages (R,Python,SQL,etc.)"
